{
  "$schema": "https://json-schema.org/draft/2020-12/schema",
  "$id": "https://ramp-protocol.org/schemas/ramp-well-known.json",
  "title": "RAMP WellKnownManifest",
  "description": "Canonical /.well-known/ramp.json document. Wire shape is protojson of ramp.v1.WellKnownManifest with UseProtoNames=true (snake_case fields, full enum value names).",
  "type": "object",
  "required": ["ver", "role", "domain"],
  "additionalProperties": true,
  "properties": {
    "ver": { "const": "1.0" },
    "role": {
      "enum": ["ROLE_AGENT", "ROLE_EXCHANGE", "ROLE_BROKER", "ROLE_PUBLISHER"]
    },
    "domain": { "type": "string", "minLength": 1 },
    "contact": { "type": "string" },
    "public_keys": {
      "type": "array",
      "minItems": 1,
      "items": { "$ref": "#/$defs/jwk" }
    },
    "invalidation_url": { "type": "string", "minLength": 1 },
    "exchanges": {
      "type": "array",
      "items": { "$ref": "#/$defs/authorizedExchange" }
    },
    "catalog_contributors": {
      "type": "array",
      "items": { "$ref": "#/$defs/catalogContributor" }
    },
    "max_intermediary_hops": { "type": "integer", "minimum": 0 },
    "base_currency": { "type": "string" },
    "supported_profiles": { "type": "array", "items": { "type": "string" } }
  },
  "allOf": [
    {
      "comment": "Agents, brokers, and exchanges MUST publish at least one signing key. Publishers MAY omit public_keys (and exchanges) — e.g. a publisher that issues no provider attestations and authorizes exchanges out of band; protojson also omits empty repeated fields, so requiring them would reject a config-empty producer.",
      "if": {
        "required": ["role"],
        "properties": { "role": { "enum": ["ROLE_AGENT", "ROLE_BROKER", "ROLE_EXCHANGE"] } }
      },
      "then": { "required": ["public_keys"] }
    }
  ],
  "$defs": {
    "jwk": {
      "type": "object",
      "required": ["kid", "kty", "crv", "use", "alg", "x", "not_before", "not_after"],
      "additionalProperties": true,
      "properties": {
        "kid": { "type": "string", "minLength": 1 },
        "kty": { "const": "OKP" },
        "crv": { "const": "Ed25519" },
        "use": { "const": "sig" },
        "alg": { "const": "EdDSA" },
        "x": { "type": "string", "pattern": "^[A-Za-z0-9_-]{43}$" },
        "not_before": {
          "type": "string",
          "pattern": "^\\d{4}-\\d{2}-\\d{2}T\\d{2}:\\d{2}:\\d{2}(\\.\\d+)?(Z|[+-]\\d{2}:\\d{2})$"
        },
        "not_after": {
          "type": "string",
          "pattern": "^\\d{4}-\\d{2}-\\d{2}T\\d{2}:\\d{2}:\\d{2}(\\.\\d+)?(Z|[+-]\\d{2}:\\d{2})$"
        }
      }
    },
    "authorizedExchange": {
      "type": "object",
      "required": ["domain", "endpoint", "relationship"],
      "additionalProperties": true,
      "properties": {
        "domain": { "type": "string", "minLength": 1 },
        "endpoint": { "type": "string", "minLength": 1 },
        "relationship": {
          "enum": [
            "PROVIDER_RELATIONSHIP_UNSPECIFIED",
            "PROVIDER_RELATIONSHIP_DIRECT",
            "PROVIDER_RELATIONSHIP_RESELLER"
          ]
        }
      }
    },
    "catalogContributor": {
      "type": "object",
      "required": ["domain", "relationship"],
      "additionalProperties": true,
      "properties": {
        "domain": { "type": "string", "minLength": 1 },
        "relationship": { "type": "string", "minLength": 1 }
      }
    }
  }
}
